{
  "schema_version": 1,
  "character": "leon",
  "character_aliases": ["leon kennedy", "kennedy"],
  "era_source_map": {
    "RE2R": "leon-re2r-cutscenes",
    "RE4R": "leon-re4r-cutscenes"
  },
  "excluded_sources": ["filmisnow-compilation"],
  "narrative_priorities": ["dso", "raccoon city"],
  "song": "in-the-end-tommee.mp3",
  "song_offset_sec": 0.0,
  "song_gain_db": -6.0,
  "default_duck_db": -10.0,
  "template": "HauntedVeteran",
  "vision_context": "Resident Evil 9 game cutscene",
  "add_titles": false,
  "apply_transitions": true,
  "add_sfx": true,
  "run_qa": true,
  "extract_missing_vo": false,
  "run_director": false,
  "build_storyboard": false,
  "build_thumbnail": true,
  "generate_captions": true,
  "build_youtube_meta": true,
  "copyright_audit": true,
  "enrich_motion": true,
  "enrich_gaze": true,
  "target_duration_sec": null,
  "export_presets": ["youtube"],
  "cluster_archetype": "single-character arc",
  "lut_name": "cinematic-teal-orange",
  "lut_intensity": 0.5,
  "platform_target": "youtube",
  "target_loudness_lufs": -14,
  "true_peak_ceiling_dbtp": -1
}
